{
  "run_id": "crawl_7be166de89e2",
  "manifest_id": "mcp-server-spec-demo",
  "manifest_revision": 2,
  "status": "completed",
  "started_at": "2026-04-16T04:28:18.429516Z",
  "ended_at": "2026-04-16T04:30:20.359733Z",
  "counters": {
    "fetched": 3,
    "new": 1,
    "updated": 0,
    "deleted": 0,
    "unchanged": 2,
    "errors": 0
  }
}
